[
  {"schema_version":"1.0.0","verification_id":"fev_confirmed","knowledge_need_id":"kn_external","verification_posture":{"seek_disconfirming_first":true,"required_dispositions":["confirmed","confirmed_with_qualification","contradicted","demoted","unverifiable"]},"verifier":{"verifier_id":"engineering-evidence-verifier","fresh_context_id":"ctx_confirmed","separate_from_researcher":true,"researcher_reasoning_available":false},"claims":[{"claim_id":"frc_release","disposition":"confirmed","checked_source_ids":["frs_docs","frs_registry"],"rationale":"The official release record matches the independent registry record."}],"conflicts":[],"uncertainty":[],"escalation":{"required":false,"tier":"none","reasons":[]},"non_authorizing":true},
  {"schema_version":"1.0.0","verification_id":"fev_qualified","knowledge_need_id":"kn_external","verification_posture":{"seek_disconfirming_first":true,"required_dispositions":["confirmed","confirmed_with_qualification","contradicted","demoted","unverifiable"]},"verifier":{"verifier_id":"engineering-evidence-verifier","fresh_context_id":"ctx_qualified","separate_from_researcher":true,"researcher_reasoning_available":false},"claims":[{"claim_id":"frc_release","disposition":"confirmed_with_qualification","checked_source_ids":["frs_docs"],"rationale":"The official record supports the date, but its version applicability is limited to the stated release line."}],"conflicts":[],"uncertainty":["Applicability outside the requested release line was not established."],"escalation":{"required":false,"tier":"none","reasons":[]},"non_authorizing":true},
  {"schema_version":"1.0.0","verification_id":"fev_contradicted","knowledge_need_id":"kn_external","verification_posture":{"seek_disconfirming_first":true,"required_dispositions":["confirmed","confirmed_with_qualification","contradicted","demoted","unverifiable"]},"verifier":{"verifier_id":"engineering-evidence-verifier","fresh_context_id":"ctx_contradicted","separate_from_researcher":true,"researcher_reasoning_available":false},"claims":[{"claim_id":"frc_release","disposition":"contradicted","checked_source_ids":["frs_docs","frs_registry"],"rationale":"The independent registry gives a different release date."}],"conflicts":[{"claim_id":"frc_release","source_ids":["frs_docs","frs_registry"],"summary":"The official release page and registry disagree on the date.","unresolved":true}],"uncertainty":[],"escalation":{"required":true,"tier":"T4","reasons":["Material conflict remains unresolved."]},"non_authorizing":true},
  {"schema_version":"1.0.0","verification_id":"fev_unverifiable","knowledge_need_id":"kn_external","verification_posture":{"seek_disconfirming_first":true,"required_dispositions":["confirmed","confirmed_with_qualification","contradicted","demoted","unverifiable"]},"verifier":{"verifier_id":"engineering-evidence-verifier","fresh_context_id":"ctx_unverifiable","separate_from_researcher":true,"researcher_reasoning_available":false},"claims":[{"claim_id":"frc_release","disposition":"unverifiable","checked_source_ids":["frs_docs"],"rationale":"The cited page was unavailable and no checked source could establish the date."}],"conflicts":[],"uncertainty":["The source could not be retrieved."],"escalation":{"required":true,"tier":"T4","reasons":["The material claim remains unverifiable."]},"non_authorizing":true}
]
